<?xml version="1.0" encoding="UTF-8"?>
<!-- 
This file specifies the available combinatory rules.

Copyright (C) 2005 David Reitter and University of Edinburgh (Michael White) 
$Revision: 1.3 $, $Date: 2005/03/22 21:49:21 $ 
-->
<rules
  name="tiny"
  xmlns:xsi="http://www.w3.org/2001/XMLSchema-instance"
  xsi:noNamespaceSchemaLocation="../rules.xsd"
>

  <!-- Application -->
  <application dir="forward"/>
  <application dir="backward"/>

  <!-- Harmonic Composition -->
  <composition dir="forward" harmonic="true"/>
  <composition dir="backward" harmonic="true"/>

  <!-- Crossed Composition -->
  <composition dir="forward" harmonic="false"/>
  <composition dir="backward" harmonic="false"/>

  <!-- Type-raising -->
  <typeraising dir="forward" useDollar="false"/>
  <typeraising dir="backward" useDollar="true"/>
  <typeraising dir="backward" useDollar="true">
    <arg><atomcat type="pp"/></arg>
  </typeraising>

</rules>